{
  "$schemaVersion": "v1",
  "generatedAt": "2026-09-13T04:33:13Z",
  "source": "github.com/search/issues?author=AndreaBozzo+is:merged",
  "items": [
    {
      "name": "polars",
      "url": "https://github.com/pola-rs/polars",
      "stars": "39.7k",
      "prs": "3",
      "desc": "Rust-native analytics work across DataFrame performance, ergonomics, and engine behavior.",
      "language": "Rust",
      "topics": [
        "arrow",
        "dataframe",
        "dataframe-library",
        "dataframes",
        "out-of-core",
        "polars",
        "python",
        "rust"
      ],
      "lastPRMergedAt": "2026-01-08T00:37:40Z",
      "prList": [
        {
          "title": "perf: Optimize ArrayFromIter implementations for ObjectArray",
          "number": 25712,
          "url": "https://github.com/pola-rs/polars/pull/25712",
          "mergedAt": "2026-01-08T00:37:40Z"
        },
        {
          "title": "docs: Fix typos in Excel and Pandas migration guides",
          "number": 25709,
          "url": "https://github.com/pola-rs/polars/pull/25709",
          "mergedAt": "2025-12-09T16:46:57Z"
        },
        {
          "title": "docs: Document schema parameter in meta methods",
          "number": 25543,
          "url": "https://github.com/pola-rs/polars/pull/25543",
          "mergedAt": "2025-12-01T15:24:54Z"
        }
      ]
    },
    {
      "name": "tokio",
      "url": "https://github.com/tokio-rs/tokio",
      "stars": "33.1k",
      "prs": "2",
      "desc": "Async runtime improvements around Rust concurrency, scheduling, and developer ergonomics.",
      "language": "Rust",
      "topics": [
        "asynchronous",
        "networking",
        "rust"
      ],
      "lastPRMergedAt": "2026-01-19T08:12:38Z",
      "prList": [
        {
          "title": "docs(time): enhance time manipulation documentation",
          "number": 7858,
          "url": "https://github.com/tokio-rs/tokio/pull/7858",
          "mergedAt": "2026-01-19T08:12:38Z"
        },
        {
          "title": "docs: add SyncIoBridge cross-references to copy functions",
          "number": 7798,
          "url": "https://github.com/tokio-rs/tokio/pull/7798",
          "mergedAt": "2025-12-29T14:29:57Z"
        }
      ]
    },
    {
      "name": "axum",
      "url": "https://github.com/tokio-rs/axum",
      "stars": "27.1k",
      "prs": "1",
      "desc": "Web framework contributions around routing, ergonomics, and service integration in Rust.",
      "language": "Rust",
      "topics": [
        "http",
        "routing",
        "rust"
      ],
      "lastPRMergedAt": "2026-02-26T10:14:21Z",
      "prList": [
        {
          "title": "fix: Return specific error message when multipart body limit is exceeded",
          "number": 3611,
          "url": "https://github.com/tokio-rs/axum/pull/3611",
          "mergedAt": "2026-02-26T10:14:21Z"
        }
      ]
    },
    {
      "name": "winget-pkgs",
      "url": "https://github.com/microsoft/winget-pkgs",
      "stars": "11.1k",
      "prs": "1",
      "desc": "winget-pkgs is one of the upstream projects where I have shipped fixes, cleanup, or implementation work.",
      "topics": [
        "hacktoberfest"
      ],
      "lastPRMergedAt": "2026-07-29T00:46:21Z",
      "prList": [
        {
          "title": "New package: AndreaBozzo.GitNodes version 0.1.0",
          "number": 396497,
          "url": "https://github.com/microsoft/winget-pkgs/pull/396497",
          "mergedAt": "2026-07-29T00:46:21Z"
        }
      ]
    },
    {
      "name": "risingwave",
      "url": "https://github.com/risingwavelabs/risingwave",
      "stars": "9.3k",
      "prs": "1",
      "desc": "Streaming database contributions across query behavior, engine details, and developer workflow.",
      "language": "Rust",
      "topics": [
        "apache-iceberg",
        "data-engineering",
        "database",
        "etl-pipeline",
        "event-streaming",
        "kafka",
        "materialized-view",
        "postgresql",
        "rust",
        "stream-processing",
        "webhook"
      ],
      "lastPRMergedAt": "2025-11-10T12:18:50Z",
      "prList": [
        {
          "title": "chore(.gitignore): reorganize sections",
          "number": 23704,
          "url": "https://github.com/risingwavelabs/risingwave/pull/23704",
          "mergedAt": "2025-11-10T12:18:50Z"
        }
      ]
    },
    {
      "name": "datafusion",
      "url": "https://github.com/apache/datafusion",
      "stars": "9.3k",
      "prs": "1",
      "desc": "Query engine fixes and improvements in the Arrow-native SQL execution stack.",
      "language": "Rust",
      "topics": [
        "arrow",
        "big-data",
        "dataframe",
        "datafusion",
        "olap",
        "python",
        "query-engine",
        "rust",
        "sql"
      ],
      "lastPRMergedAt": "2026-02-02T04:06:09Z",
      "prList": [
        {
          "title": "Use return_field_from_args in information schema and date_trunc",
          "number": 20079,
          "url": "https://github.com/apache/datafusion/pull/20079",
          "mergedAt": "2026-02-02T04:06:09Z"
        }
      ]
    },
    {
      "name": "lance",
      "url": "https://github.com/lance-format/lance",
      "stars": "7.1k",
      "prs": "2",
      "desc": "Columnar storage and vector-data work in the Lance ecosystem.",
      "language": "Rust",
      "topics": [
        "apache-arrow",
        "computer-vision",
        "data-analysis",
        "data-analytics",
        "data-centric",
        "data-format",
        "data-science",
        "dataops",
        "deep-learning",
        "duckdb",
        "embeddings",
        "llms",
        "machine-learning",
        "mlops",
        "python",
        "rust"
      ],
      "lastPRMergedAt": "2026-01-20T22:23:36Z",
      "prList": [
        {
          "title": "fix: skip missing indices in compaction rewrite",
          "number": 5739,
          "url": "https://github.com/lance-format/lance/pull/5739",
          "mergedAt": "2026-01-20T22:23:36Z"
        },
        {
          "title": "fix(python): correct type hint for to_tensor_fn parameter",
          "number": 5577,
          "url": "https://github.com/lance-format/lance/pull/5577",
          "mergedAt": "2026-01-12T22:25:40Z"
        }
      ]
    },
    {
      "name": "arrow-rs",
      "url": "https://github.com/apache/arrow-rs",
      "stars": "3.6k",
      "prs": "4",
      "desc": "Rust-side work in the Arrow ecosystem around columnar data and query plumbing.",
      "language": "Rust",
      "topics": [
        "arrow",
        "parquet"
      ],
      "lastPRMergedAt": "2026-08-30T21:49:41Z",
      "prList": [
        {
          "title": "Fix FFI import of zero-length `Utf8`/`Binary` arrays at a non-zero offset",
          "number": 10916,
          "url": "https://github.com/apache/arrow-rs/pull/10916",
          "mergedAt": "2026-08-30T21:49:41Z"
        },
        {
          "title": "Report the number of rows padded by `with_truncated_rows`",
          "number": 10579,
          "url": "https://github.com/apache/arrow-rs/pull/10579",
          "mergedAt": "2026-08-10T12:20:58Z"
        },
        {
          "title": "docs: update examples in ArrowReaderOptions to use in-memory buffers",
          "number": 9163,
          "url": "https://github.com/apache/arrow-rs/pull/9163",
          "mergedAt": "2026-01-14T22:16:36Z"
        },
        {
          "title": "docs(parquet): add example for preserving dictionary encoding",
          "number": 9116,
          "url": "https://github.com/apache/arrow-rs/pull/9116",
          "mergedAt": "2026-01-10T12:22:45Z"
        }
      ]
    },
    {
      "name": "etl",
      "url": "https://github.com/supabase/etl",
      "stars": "2.3k",
      "prs": "2",
      "desc": "Data ingestion and transformation contributions in a production-facing ETL stack.",
      "language": "Rust",
      "topics": [
        "logical-replication",
        "postgres",
        "postgresql",
        "replication",
        "rust",
        "rust-lang"
      ],
      "lastPRMergedAt": "2025-12-22T07:36:50Z",
      "prList": [
        {
          "title": "docs(etl): add documentation for CellNonOptional and ArrayCellNonOptional",
          "number": 482,
          "url": "https://github.com/supabase/etl/pull/482",
          "mergedAt": "2025-12-22T07:36:50Z"
        },
        {
          "title": "refactor(etl): simplify Event::has_table_id for Truncate variant",
          "number": 480,
          "url": "https://github.com/supabase/etl/pull/480",
          "mergedAt": "2025-12-01T12:19:11Z"
        }
      ]
    },
    {
      "name": "datapizza-ai",
      "url": "https://github.com/datapizza-labs/datapizza-ai",
      "stars": "2.2k",
      "prs": "5",
      "desc": "Applied AI engineering work across product integrations and developer-facing features.",
      "language": "Python",
      "topics": [
        "agent",
        "ai",
        "genai",
        "llm",
        "python"
      ],
      "lastPRMergedAt": "2026-02-20T10:00:54Z",
      "prList": [
        {
          "title": "feat(mcp): add persistent session support to MCPClient",
          "number": 97,
          "url": "https://github.com/datapizza-labs/datapizza-ai/pull/97",
          "mergedAt": "2026-02-20T10:00:54Z"
        },
        {
          "title": "refactor(fastembedder): simplify embed methods and fix async handling",
          "number": 106,
          "url": "https://github.com/datapizza-labs/datapizza-ai/pull/106",
          "mergedAt": "2026-01-21T10:54:55Z"
        },
        {
          "title": "fix: add metadata parameter support to parsers",
          "number": 77,
          "url": "https://github.com/datapizza-labs/datapizza-ai/pull/77",
          "mergedAt": "2025-11-03T10:28:27Z"
        },
        {
          "title": "fix: support list of file paths in IngestionPipeline.run()",
          "number": 67,